{
  "id": "001",
  "title": "Add MIT LICENSE file",
  "status": "open",
  "priority": "P1",
  "category": "documentation",
  "difficulty": "beginner",
  "description": "The repository currently does not have a LICENSE file. Add a standard MIT License file at the root of the repository. Use the current year and the repository owner as copyright holder.",
  "acceptance_criteria": [
    "A file named LICENSE exists at the repository root",
    "The file contains the full MIT License text",
    "Copyright year and holder are correctly set"
  ],
  "suggested_files": [
    "LICENSE"
  ],
  "labels": ["docs", "good-first-job", "legal"],
  "estimated_effort": "small",
  "created_at": "2026-09-06",
  "updated_at": "2026-09-06"
}
